{
  "schema_version": "carnet.quote_repair_proposals/1",
  "dry_run": true,
  "applied": false,
  "policy": "Proposals only. No evidence file, authored quote, value, id or URL is modified by this report. A proposal is text copied verbatim from the snapshot named in the same entry.",
  "evidence_files_analyzed": {
    "evidence/ford_everest.json": "bfc24961d1816eed592f84a378b6083fb44e369809c246df788237813c7b8190",
    "evidence/toyota_land_cruiser.json": "8d1e12ca92bcb55c0219e60a5f10f50c4fa55ef357b67a925210217b4c1e0303",
    "evidence/toyota_camry.json": "7ae1126e33f0897448be8896653f95f828a6a71c09ee28d7dcdb97c6293d4ef1"
  },
  "summary": {
    "unresolved_records_analyzed": 64,
    "by_classification": {
      "SAFE_QUOTE_REPAIR": 1,
      "FACTUAL_CHANGE": 1,
      "NEEDS_MANUAL_REVIEW": 62
    },
    "by_model": {
      "Ford Everest": {
        "SAFE_QUOTE_REPAIR": 1,
        "FACTUAL_CHANGE": 0,
        "NEEDS_MANUAL_REVIEW": 32,
        "analyzed": 33
      },
      "Toyota Land Cruiser": {
        "SAFE_QUOTE_REPAIR": 0,
        "FACTUAL_CHANGE": 0,
        "NEEDS_MANUAL_REVIEW": 20,
        "analyzed": 20
      },
      "Toyota Camry": {
        "SAFE_QUOTE_REPAIR": 0,
        "FACTUAL_CHANGE": 1,
        "NEEDS_MANUAL_REVIEW": 10,
        "analyzed": 11
      }
    },
    "by_reason": {
      "FACTUAL_CHANGE:NUMBER_CHANGED_IN_SAME_PHRASE": 1,
      "NEEDS_MANUAL_REVIEW:AMBIGUOUS_LOCATION": 3,
      "NEEDS_MANUAL_REVIEW:COLUMN_OR_VARIANT_AMBIGUITY": 7,
      "NEEDS_MANUAL_REVIEW:MULTI_TRIM_COLUMNS": 8,
      "NEEDS_MANUAL_REVIEW:NO_SNAPSHOT": 24,
      "NEEDS_MANUAL_REVIEW:OLD_QUOTE_NOT_LOCATED": 1,
      "NEEDS_MANUAL_REVIEW:SOURCE_HAS_FACTUAL_CHANGE": 5,
      "NEEDS_MANUAL_REVIEW:VALIDATOR_WOULD_FAIL": 2,
      "NEEDS_MANUAL_REVIEW:VALUE_NOT_STATED": 11,
      "NEEDS_MANUAL_REVIEW:YEAR_CONTEXT": 1,
      "SAFE_QUOTE_REPAIR:VERBATIM_PASSAGE_STATES_SAME_VALUES": 1
    }
  },
  "verified_values_if_all_safe_repairs_were_approved": {
    "total": {
      "before": 71,
      "after": 73
    },
    "by_model": {
      "Ford Everest": {
        "verified_values_before": 21,
        "verified_values_after": 23,
        "newly_verified": {
          "cylinders": [
            "5"
          ],
          "engine_sizes": [
            "3.2L"
          ]
        },
        "no_longer_verified": {},
        "records_passing_before": 13,
        "records_passing_after": 14,
        "simulation_validation_errors": []
      },
      "Toyota Land Cruiser": {
        "verified_values_before": 31,
        "verified_values_after": 31,
        "newly_verified": {},
        "no_longer_verified": {},
        "records_passing_before": 20,
        "records_passing_after": 20,
        "simulation_validation_errors": []
      },
      "Toyota Camry": {
        "verified_values_before": 19,
        "verified_values_after": 19,
        "newly_verified": {},
        "no_longer_verified": {},
        "records_passing_before": 12,
        "records_passing_after": 12,
        "simulation_validation_errors": []
      }
    }
  },
  "proposals": [
    {
      "evidence_id": "FE-001",
      "model": "Ford Everest",
      "evidence_file": "evidence/ford_everest.json",
      "source_id": "FE-S1",
      "source_url": "https://fordbahrain.com/wp-content/uploads/2025/08/MY25-Everest-Spec-Sheet-EN.pdf",
      "source_integrity_state": "SNIPPET_ONLY",
      "classification": "NEEDS_MANUAL_REVIEW",
      "reason_code": "NO_SNAPSHOT",
      "reason": "The source could not be retrieved (HTTP error / search snippet only), so there is no preserved snapshot to repair against.",
      "old_quote": "Ford Everest 2025 Technical Specifications 2025 XLS XLS XLT LIMITED Mechanical Transmission 6-Speed SelectShift AT 10-Speed SelectShift AT 10-Speed SelectShift AT 10-Speed SelectShift AT Engine 2.0L Turbo Diesel 170 Hp 405 N.m 2.3L I-4 EcoBoost® 296 Hp 420 N.m 2.3L I-4 EcoBoost® 296 Hp 420 N.m 2.3L I-4 EcoBoost® 296 Hp 420 N.m Drive Train 4x4 4x4 4x4 4x4",
      "proposed_exact_quote": null,
      "proposed_segments": [],
      "authored_values_supported": {},
      "authored_values_unsupported": [],
      "old_quote_token_coverage": null,
      "old_quote_tokens_not_located": [],
      "confidence": null,
      "factual_change": null,
      "snapshot_kind": "none",
      "snapshot_path": null,
      "snapshot_sha256": null,
      "application_requires_snapshot_promotion": false
    },
    {
      "evidence_id": "FE-002",
      "model": "Ford Everest",
      "evidence_file": "evidence/ford_everest.json",
      "source_id": "FE-S1",
      "source_url": "https://fordbahrain.com/wp-content/uploads/2025/08/MY25-Everest-Spec-Sheet-EN.pdf",
      "source_integrity_state": "SNIPPET_ONLY",
      "classification": "NEEDS_MANUAL_REVIEW",
      "reason_code": "NO_SNAPSHOT",
      "reason": "The source could not be retrieved (HTTP error / search snippet only), so there is no preserved snapshot to repair against.",
      "old_quote": "Ford Everest 2025 Technical Specifications 2025 XLS XLS XLT LIMITED Mechanical Transmission 6-Speed SelectShift AT 10-Speed SelectShift AT 10-Speed SelectShift AT 10-Speed SelectShift AT Engine 2.0L Turbo Diesel 170 Hp 405 N.m 2.3L I-4 EcoBoost® 296 Hp 420 N.m 2.3L I-4 EcoBoost® 296 Hp 420 N.m 2.3L I-4 EcoBoost® 296 Hp 420 N.m Drive Train 4x4 4x4 4x4 4x4",
      "proposed_exact_quote": null,
      "proposed_segments": [],
      "authored_values_supported": {},
      "authored_values_unsupported": [],
      "old_quote_token_coverage": null,
      "old_quote_tokens_not_located": [],
      "confidence": null,
      "factual_change": null,
      "snapshot_kind": "none",
      "snapshot_path": null,
      "snapshot_sha256": null,
      "application_requires_snapshot_promotion": false
    },
    {
      "evidence_id": "FE-003",
      "model": "Ford Everest",
      "evidence_file": "evidence/ford_everest.json",
      "source_id": "FE-S1",
      "source_url": "https://fordbahrain.com/wp-content/uploads/2025/08/MY25-Everest-Spec-Sheet-EN.pdf",
      "source_integrity_state": "SNIPPET_ONLY",
      "classification": "NEEDS_MANUAL_REVIEW",
      "reason_code": "NO_SNAPSHOT",
      "reason": "The source could not be retrieved (HTTP error / search snippet only), so there is no preserved snapshot to repair against.",
      "old_quote": "Ford Everest 2025 Technical Specifications 2025 XLS XLS XLT LIMITED Mechanical Transmission 6-Speed SelectShift AT 10-Speed SelectShift AT 10-Speed SelectShift AT 10-Speed SelectShift AT Engine 2.0L Turbo Diesel 170 Hp 405 N.m 2.3L I-4 EcoBoost® 296 Hp 420 N.m 2.3L I-4 EcoBoost® 296 Hp 420 N.m 2.3L I-4 EcoBoost® 296 Hp 420 N.m Drive Train 4x4 4x4 4x4 4x4",
      "proposed_exact_quote": null,
      "proposed_segments": [],
      "authored_values_supported": {},
      "authored_values_unsupported": [],
      "old_quote_token_coverage": null,
      "old_quote_tokens_not_located": [],
      "confidence": null,
      "factual_change": null,
      "snapshot_kind": "none",
      "snapshot_path": null,
      "snapshot_sha256": null,
      "application_requires_snapshot_promotion": false
    },
    {
      "evidence_id": "FE-004",
      "model": "Ford Everest",
      "evidence_file": "evidence/ford_everest.json",
      "source_id": "FE-S1",
      "source_url": "https://fordbahrain.com/wp-content/uploads/2025/08/MY25-Everest-Spec-Sheet-EN.pdf",
      "source_integrity_state": "SNIPPET_ONLY",
      "classification": "NEEDS_MANUAL_REVIEW",
      "reason_code": "NO_SNAPSHOT",
      "reason": "The source could not be retrieved (HTTP error / search snippet only), so there is no preserved snapshot to repair against.",
      "old_quote": "Ford Everest 2025 Technical Specifications 2025 XLS XLS XLT LIMITED Mechanical Transmission 6-Speed SelectShift AT 10-Speed SelectShift AT 10-Speed SelectShift AT 10-Speed SelectShift AT Engine 2.0L Turbo Diesel 170 Hp 405 N.m 2.3L I-4 EcoBoost® 296 Hp 420 N.m 2.3L I-4 EcoBoost® 296 Hp 420 N.m 2.3L I-4 EcoBoost® 296 Hp 420 N.m Drive Train 4x4 4x4 4x4 4x4",
      "proposed_exact_quote": null,
      "proposed_segments": [],
      "authored_values_supported": {},
      "authored_values_unsupported": [],
      "old_quote_token_coverage": null,
      "old_quote_tokens_not_located": [],
      "confidence": null,
      "factual_change": null,
      "snapshot_kind": "none",
      "snapshot_path": null,
      "snapshot_sha256": null,
      "application_requires_snapshot_promotion": false
    },
    {
      "evidence_id": "FE-005",
      "model": "Ford Everest",
      "evidence_file": "evidence/ford_everest.json",
      "source_id": "FE-S2",
      "source_url": "https://www.me.ford.com/en/are/suvs/everest/",
      "source_integrity_state": "UNAVAILABLE",
      "classification": "NEEDS_MANUAL_REVIEW",
      "reason_code": "NO_SNAPSHOT",
      "reason": "The source could not be retrieved (HTTP error / search snippet only), so there is no preserved snapshot to repair against.",
      "old_quote": "The Ford Everest is a 7-seater SUV, offering spacious seating for families and group travel. The Ford Everest offers 4x4 with 10-speed SelectShift automatic transmission designed for smooth and responsive driving.",
      "proposed_exact_quote": null,
      "proposed_segments": [],
      "authored_values_supported": {},
      "authored_values_unsupported": [],
      "old_quote_token_coverage": null,
      "old_quote_tokens_not_located": [],
      "confidence": null,
      "factual_change": null,
      "snapshot_kind": "none",
      "snapshot_path": null,
      "snapshot_sha256": null,
      "application_requires_snapshot_promotion": false
    },
    {
      "evidence_id": "FE-006",
      "model": "Ford Everest",
      "evidence_file": "evidence/ford_everest.json",
      "source_id": "FE-S2",
      "source_url": "https://www.me.ford.com/en/are/suvs/everest/",
      "source_integrity_state": "UNAVAILABLE",
      "classification": "NEEDS_MANUAL_REVIEW",
      "reason_code": "NO_SNAPSHOT",